title,synopsis,genre_id
The Legend of Zelda: A Link to the Past,"Timeless action-adventure with a legendary quest, dungeon exploration, and dual-world mechanic.",
The Lion King,Colorful platformer retelling the Disney film with smooth animation and musical moments.,
The Lord of the Rings: Volume 1,RPG adventure adapting Tolkien’s story as a classic quest through Middle‑earth.,
The Lost Vikings,"Puzzle-platformers where you switch between three Vikings, each with unique abilities, to solve levels.",
The Lost Vikings II,"Puzzle-platformers where you switch between three Vikings, each with unique abilities, to solve levels.",
Madden NFL 98,Further refined football sim with improved graphics and deeper gameplay modes.,
Madou Monogatari: Hanamaru Daiyouchi Enji,Cute dungeon crawler leading into the Puyo Puyo series with charming visuals.,
Magic Boy,Arcade platformer with color-matching gimmicks in enchanted levels.,
Magic Knight Rayearth,Tactical RPG with magic-girl anime heroes embarking on a quest to rescue a mystical realm.,
Magic Sword,Co-op hack-and-slash through fantasy dungeons with weapon upgrades.,
Magical Drop,Fast-paced puzzle where you catch and toss colored gems to chain combos.,
Magical Drop II,Sequel with new characters and faster combo gameplay mechanics.,
Magical Pop'n,Lighthearted platformer with toy-themed worlds and whimsical challenges.,
Magical Taruruuto-kun: Magic Adventure,RPG based on anime with humorous story and magical puzzles.,
Magna Braban: Henreki no Yuusha,Strategy RPG where heroes transform through narratives and tactical grid combat.,
Mahjong Club,Card game sim featuring casual mahjong with multiplayer support.,
Mahjong Gokuu Tenjiku,Fantasy mahjong with mythological tile themes and special powers.,
Mahjong Hanjouki,Mahjong arcade-style with fast matches and high score chasing.,
Mahjong Hishouden - Shin Naki no Ryuu,Epic mahjong with storytelling and intense matchups.,
Mahjong Sengoku Monogatari,Historical-themed mahjong with Sengoku warlord characters on tiles.,
Mahjong Taikai II,Competitive mahjong with advanced rules and multiplayer features.,
Mahoujin Guruguru,"RPGs based on the comedic anime with magic, levity, and dungeon puzzles.",
Mahoujin Guruguru 2,"RPGs based on the comedic anime with magic, levity, and dungeon puzzles.",
Majin Tensei,Strategy RPG spin-off of Shin Megami Tensei with demon summoning and tactical battles.,
Majin Tensei II: Spiral Nemesis,Strategy RPG spin-off of Shin Megami Tensei with demon summoning and tactical battles.,
Major Title,Realistic golf sim with popular courses and mid-range gameplay depth.,
Maka Maka,Adult-oriented puzzle game with erotic themes (caution: mature content).,
Makeruna! Makendou 2: Kimero! Youkai Souri Daijin,Fighting game infused with Japanese folklore and humorous yokai warriors.,
Manchester United Championship Soccer,Soccer sim featuring the iconic club with match tactics and team management.,
Mario & Wario,Puzzle game where Wario causes mischief and Mario helps navigate stages using tools.,
Mario is Missing!,Educational adventure where Mario travels the world teaching geography.,
Mario no Super Picross,Puzzle game using Picross logic puzzles with Mario-themed images.,
Mario Paint,"Creative tool for drawing, composing music, and mini-games including the iconic fly-swatting.",
Mario's Early Years: Fun With Letters,Educational game teaching letters through Mario-themed mini-games.,
Mario's Early Years: Fun With Numbers,Number-based learning with Mario guiding kids through activities.,
Mario's Early Years: Preschool Fun,Broad educational title for preschool kids with literacy and math mini-games.,
Mario's Time Machine,Educational historical adventure where Mario travels through time to collect artifacts.,
Mark Davis' The Fishing Master,Fishing sim featuring angler Mark Davis with tournament goals and real water scenarios.,
Marko's Magic Football,Fantasy football adventure where spells and strategy mix with gridiron gameplay.,
Marmalade Boy,Visual novel adventure based on the anime’s romantic melodramas and slice‑of‑life storytelling.,
Marvel Super Heroes: War of the Gems,Fighting game featuring Marvel characters battling through gem-themed stages.,
Marvelous: Mouhitotsu no Takarajima,Adventure-puzzle game with treasure hunting and cooperative gameplay.,
Mary Shelley's Frankenstein,Action-adventure retelling Frankenstein’s story with gothic levels and narrative.,
Maten Densetsu - Senritsu no Ooparts,Sci-fi RPG puzzle hybrid exploring ancient artifacts and cryptic technologies.,
Math Blaster: Episode 1,Educational game teaching arithmetic through engaging space-themed challenges.,
Matsukata Hiroki no Super Trolling,Fishing sim featuring pro fisherman Hiroki Matsukata with lifelike casting mechanics.,
Matsumura Kunihiro Den - Saikyou no Rekishi o Nurikaero!,Historical educational game where you rewrite Japanese history through missions.,
Maui Mallard in Cold Shadow,Platformer starring Donald Duck as detective Maui Mallard solving mysteries in shadowy locales.,
Mazinger Z,Mecha action game with giant robots and city-destroying battles based on classic anime.,
Mecarobot Golf,Futuristic golf where you pilot mecha to swing high-powered balls across sci-fi courses.,
MechWarrior,Simulation of piloting giant mechs in realistic combat scenarios.,
MechWarrior 3050,Tactical mech simulation with customization and war-based missions.,
Mega lo Mania,Strategy game where you progress through ages by planning and conquering across map regions.,
Mega Man 7,Classic side-scrolling action with Wily-stage design and new robot bosses.,
Mega Man Soccer,Sports action where Mega Man takes to the soccer field with special moves and robot teammates.,
Mega Man X,"Action-platformer with speed, wall-dashing, and upgradeable armor mechanics.",
Mega Man X2,Sequel improving mobility and boss design in the Mega Man X saga.,
Mega Man X3,Concludes X trilogy with armor shards and selectable alternate weapons.,
Melfand Stories,Fantasy RPG with turn-based battles and a narrative about lost kingdoms.,
Metal Combat: Falcon's Revenge,Light gun shooter where you pilot mechs to blast enemies on screen.,
Metal Marines,Real-time strategy sim with futuristic naval bases and fleet management.,
Metal Max 2,Open-world post-apocalyptic RPG with customizable vehicles and monster hunting.,
Metal Max Returns,Expanded version of the Metal Max framework with new quests and enhanced gameplay.,
Metal Morph,Action-platformer where you can transform into other life forms to traverse levels.,
Metal Slader Glory - Director's Cut,Enhanced visual novel with in-depth narrative and expanded artwork.,
Metal Warriors,Mech action sidescroller with team-based mechanics and futuristic settings.,
Michael Andretti's Indy Car Challenge,Racing sim featuring Indy car legend Michael Andretti and realistic tracks.,
Michael Jordan: Chaos in the Windy City,Beat-’em‑up where MJ brawls through city streets to save a kidnapped kids.,
Mickey and Donald's Magical Adventure 3,Platformer starring Mickey and Donald in whimsical cartoon worlds.,
Mickey Mania: The Timeless Adventures of Mickey Mouse,Platformer recreating classic Mickey shorts with hand-drawn animation.,
Mickey no Tokyo Disneyland Daibouken,Disney-themed platformer exploring Tokyo Disneyland with interactive rides.,
Mickey's Ultimate Challenge,Educational game combining trivia quizzes and puzzles with Disney characters.,
Micro Machines,"Top-down mini-car racing with track hazards, loops, and competitive multiplayer fun.",
Micro Machines 2: Turbo Tournament,"Miniature car racing with fast tracks, varied environments, and multiplayer chaos.",
Midway Presents Arcade's Greatest Hits: The Atari Collection 1,Compilation of classic Atari arcade games in retro-inspired collection.,
Might and Magic II: Gates to Another World,"Classic first-person RPG with expansive world, branching classes, and strategic turn-based combat.",
Might and Magic III: Isles of Terra,"Deep RPG with sprawling maps, party-based progression, and branching storylines.",
Might and Magic: Book II (Japan),"Early export version of Might & Magic II, localized for Japanese audiences.",
Mighty Morphin Power Rangers,"Side-scrolling beat-’em-up starring the TV heroes, including special moves and cooperative combat.",
Mighty Morphin Power Rangers: The Fighting Edition,One-on-one fighting game featuring Power Rangers and villain characters.,
Mighty Morphin Power Rangers: The Movie,License-based beat-’em-up platformer recreating movie scenes with Ranger powers.,
Milandra,"2D RPG game, developed by Tomcat System and published by ASCII Entertainment, exclusively for Super Nintendo.",
Mini Yonku Let's & Go!! Power WGP 2,"Racing game based on the model car anime, featuring track customization and miniature car speed.",
Mini Yonku Shining Scorpion - Lets n Go!!,Model car racing with drifting mechanics and competitive mini-track design.,
Miracle Casino Paradise,"Relaxing casino simulator featuring slot, poker, and themed minigames in paradise setting.",
Miracle Girls,Action-RPG based on the manga/anime where twins use psychic powers to solve mysteries and support each other.,
Miyaji Shachou no Pachinko Fan - Shouri Sengen,Pachinko simulation with manager-style elements featuring company president gameplay.,
Mizuki Shigeru no Youkai Hyakkiyakou,"Adventure game based on folkloric monster tales by Mizuki, exploring yokai-filled scenarios.",
MLBPA Baseball,"Baseball sim featuring licensed MLB players (via players’ association), stat-driven matches.",
Mohawk & Headphone Jack,Abstract puzzle game combining rhythm and spatial themes in surreal music levels.,
Momotarou Dentetsu Happy,"Board-style travel game where players tour Japan by train, buying stations and collecting fortune.",
Monopoly,"Classic board game adaptation—buy properties, conduct auctions, and bankrupt opponents.",
Monstania,Monster-raising RPG where you capture and train creatures to battle through story and unlock evolutions.,
Monster Maker III: Hikari no Majutsushi,RPG focused on creating and combining monsters through magical synthesis to form powerful allies.,
Monster Maker Kids: Ousama ni Naritai,Lighthearted monster creation game targeted at children—collect and transform cute creatures.,
Mortal Kombat,"Groundbreaking 2D fighter famous for digitized sprites, visceral finishers, and competitive combat.",
Mortal Kombat 3,"Faster-paced fighting with weapon usage, run moves, and cinematic backgrounds.",
Mortal Kombat II,"Sequel with enhanced graphics, new fighters, improved combos, and expanded fatalities.",
Motoko-chan no Wonder Kitchen,Educational cooking sim with adorable characters and hands-on ingredient mini-games.,
Motteke Oh! Dorobou,"Party mini-games inspired by the anime series, filled with quirky comedic challenges.",
Mountain Bike Rally,"Racing sim with mountain trails, realistic bike handling, and terrain-based challenges.",
The Magical Quest Starring Mickey Mouse,Platformer where Mickey uses costumes with unique powers to rescue Minnie.,
The Mahjong Touhaiden,Mahjong simulation with fantasy-styled tiles and story-driven competitive matches.,
The Mask,Action-platformer based on the movie—Madcap levels and crazy powers following the titular character.,
The Monopoly Game 2,"Digital version of the board game with new boards, updated rules, and AI opponents.",
Mouryou Senki Madara 2,Adventure RPG continuing a dark fantasy saga with complex story and character progression.,
Mr. Bloppy Saves the World,Quirky platformer where a sludge blob hero saves the planet in a comedic campaign.,
Mr. Do!,"Classic maze arcade game where you dig tunnels, collect cherries, and avoid monsters.",
Mr. Nutz,"Colorful platformer starring a squirrel saving a forest with spins, jumps, and acrobatic moves.",
Ms. Pac-Man,"Iconic maze-chase game with new mazes, smarter ghosts, and quicker gameplay than the original.",
Mujintou Monogatari,"Desert island survival RPG where you gather resources, craft tools, and build shelter.",
Multi Play Volleyball,Beach volleyball game supporting multiplayer play with simple arcade-style action.,
Musya: The Classic Japanese Tale of Horror,Atmospheric hack-and-slash set in feudal Japan fighting yokai in dark temples.,
Mystery Circle,Puzzle game focused on logical deduction and restoring corrupted patterns in circular grids.,
Mystic Ark,Spiritual successor to Zelda-style action RPGs with multiple overlapping stories and unique gameplay mechanics.,
Nage Libre - Seijaku no Suishin,Arena RPG combining card strategy and tactical combat with quick decision-making.,
Nakajima Satoru F-1 Hero '94,Formula 1 racing sim featuring real drivers and circuits from the '94 season.,
Nakajima Satoru Kanshuu: Super F-1 Hero,"Enhanced follow-up with supervision by driver Nakajima, improved physics and visuals.",
Nakano Kouichi Kanshuu Keirin Ou,"Bicycle racing sim under guidance of pro cyclist Nakano, focusing on keirin tactics and pacing.",
Naki no Ryuu - Mahjong Hishouden,"Mahjong game based on the ""Legend of the Bloody Death"" anime, featuring dramatic matches.",
Namcot Open,Stylish golf sim combining realistic swing mechanics and attractive stylized visuals.,
Nangoku Shounen Papuwa-kun,Action-platformer based on the eccentric manga with paranormal themes and quirky humor.,
Naruhodo! The World,"Trivia game testing player knowledge of geography, culture, and international facts.",
Natsuki Crisis Battle,Anime fighting game featuring female fighters with dramatic attacks and storyline arcs.,
NBA All-Star Challenge,Close-action basketball sim highlighting fast-paced five-on-five gameplay.,
NBA Give N Go,"Arcadey basketball emphasizing alley-oops, dunks, and quick offensive moves.",
NBA Hang Time,"Upbeat arcade basketball with alley-oops, 3-on-3 matches, and exaggerated athleticism.",
NBA Jam,"Legendary arcade-style basketball relishing in over-the-top dunks, fast play, and frenzied commentary.",
NBA Jam: Tournament Edition,"Legendary arcade-style basketball relishing in over-the-top dunks, fast play, and frenzied commentary with new rosters, hidden characters, and improved AI to the classic formula.",
NBA Live 95,"Annualized basketball sim series with evolving rosters, improved realism, and new features.",
NBA Live 96,"Annualized basketball sim series with evolving rosters, improved realism, and new features.",
NBA Live 97,"Annualized basketball sim series with evolving rosters, improved realism, and new features.",
NBA Live 98,"Annualized basketball sim series with evolving rosters, improved realism, and new features.",
NBA Showdown,One-on-one basketball with streetball styling and high-energy scoring.,
NCAA Basketball,"College basketball sim with team play, strategy, and NCAA-style rules.",
NCAA Final Four Basketball,Tournament-based college basketball with bracket-style competition.,
NCAA Football,"College football title featuring playbooks, team strategy, and seasonal tournaments.",
NCW: Natsume Championship Wrestling,"Wrestling sim with colorful characters, flashy moves, and dynamic arenas.",
Nekketsu Tairiku Burning Heroes,"A beat ’em up game in the style of Kunio-kun, featuring street fights, special moves, and charismatic characters.",
Neugier: Umi to Kaze no Kodou,A cinematic platformer with stylized visuals and a dramatic story involving the sea and wind.,
New 3D Golf Simulation - Harukanaru Augusta,"A golf simulator focused on the iconic Augusta National course, with realistic physics and tournament modes.",
New 3D Golf Simulation - Waialae no Kiseki,"Another golf simulator emphasizing the Waialae Country Club in Hawaii, featuring detailed graphics and strategic gameplay.",
New Yatterman - Nandai Kandai Yajirobee,Comedy-platformer based on Yatterman anime featuring mechanical mayhem.,
Newman/Haas IndyCar featuring Nigel Mansell,Open-wheel racing sim where you pilot Mansell’s car through Indy circuits.,
NFL Football,"American football sims with authentic teams, season modes, and play-calling options.",
NFL Pro Football '94,Arcade/Simulation hybrid simulating quarterback play with licensed team rosters.,
NFL Quarterback Club,"Annual hockey sim with improved AI, better graphics, and detailed team rosters through the years.",
NFL Quarterback Club 96,"Annual hockey sim with improved AI, better graphics, and detailed team rosters through the years.",
NHL '94,"Annual hockey sim with improved AI, better graphics, and detailed team rosters through the years.",
NHL 95,"Annual hockey sim with improved AI, better graphics, and detailed team rosters through the years.",
NHL 96,"Annual hockey sim with improved AI, better graphics, and detailed team rosters through the years.",
NHL 97,"Annual hockey sim with improved AI, better graphics, and detailed team rosters through the years.",
NHL 98,"Annual hockey sim with improved AI, better graphics, and detailed team rosters through the years.",
NHL Stanley Cup,Official NHL championship bracket-style hockey sim with realistic league-style play.,
NHLPA Hockey 93,Early NHL sim featuring real players (via players’ association license) and arcade controls.,
Nice de Shot,Photography-themed game where timing and framing shots earns points and creativity.,
Nichibutsu Arcade Classics,Collections of classic Nichibutsu shooter and puzzle arcade titles for nostalgia fans.,
Nichibutsu Arcade Classics 2: Heiankyou Alien,Collections of classic Nichibutsu shooter and puzzle arcade titles for nostalgia fans.,
Nichibutsu Collection 1,Broader compilations of Namco/Nintendo classics including licensed ports and obscure titles.,
Nichibutsu Collection 2,Broader compilations of Namco/Nintendo classics including licensed ports and obscure titles.,
Nickelodeon Guts,"Game-show adaptation based on the TV show, testing athletic and trivia challenges.",
Nigel Mansell's World Championship Racing,"F1 sim featuring Nigel Mansell, including race weekends and car tuning.",
Ninja Gaiden Trilogy,Side-scrolling ninja adventures across three action-packed entries.,
Nintama Rantarou,Educational platformer based on comedy ninja anime series with child-friendly gameplay.,
Nintama Rantarou 2,Educational platformer based on comedy ninja anime series with child-friendly gameplay.,
Nintama Rantarou 3,Educational platformer based on comedy ninja anime series with child-friendly gameplay.,
Nintama Rantarou Special,Educational platformer based on comedy ninja anime series with child-friendly gameplay.,
Nintendo PowerFest '94,Tournament-style bundle including game modes and password competitions across selected titles.,
Nishijin Pachinko Monogatari,Pachinko simulation trilogy exploring different machines with mini-games and tutorials.,
Nishijin Pachinko Monogatari 2,Pachinko simulation trilogy exploring different machines with mini-games and tutorials.,
Nishijin Pachinko Monogatari 3,Pachinko simulation trilogy exploring different machines with mini-games and tutorials.,
No Escape,Action game based on the film; evade pursuers and survive dystopian chases.,
No Hash 23638,(Details unavailable—perhaps an obscure or canceled title.),
Nobunaga Kouki,Series of historical strategy sims where you manage feudal Japan as warlord Oda Nobunaga.,
Nobunaga no Yabou: Haouden,Series of historical strategy sims where you manage feudal Japan as warlord Oda Nobunaga.,
Nobunaga no Yabou: Tenshouki,Series of historical strategy sims where you manage feudal Japan as warlord Oda Nobunaga.,
Nobunaga's Ambition,Series of historical strategy sims where you manage feudal Japan as warlord Oda Nobunaga.,
Nobunaga's Ambition: Lord of Darkness,Series of historical strategy sims where you manage feudal Japan as warlord Oda Nobunaga.,
Nolan Ryan's Baseball,Baseball sim featuring pitcher Nolan Ryan—emphasizing realistic pitching mechanics.,
Nomark Baku Haitou - Shijou Saikyou no Janshi-tachi,Fighting game based on rock-paper-scissors battles in humorous animations.,
Nontan to Issho: Kurukuru Puzzle,Children’s puzzle game featuring Nontan rotating shapes to match patterns.,
Nosferatu,Horror adventure with Gothic visuals and vampire-tinged narrative.,
Numbers Paradise,Number-themed puzzle game challenging math logic across levels.,
O-chan no Oekaki Logic,Drawing-based puzzle game where you create images by solving logic picross-style puzzles.,
Obitus,Weird action-adventure RPG blending haunted mansion exploration with visual novel storytelling.,
Oda Nobunaga: Haou no Gundan,Strategy sim focusing on Oda’s campaigns to unify feudal Japan—military tactics and alliances.,
Oekaki Logic,Drawing puzzle games building images using numbered grid logic.,
Oekaki Logic 2,Drawing puzzle games building images using numbered grid logic.,
Ogre Battle: The March of the Black Queen,Tactical RPG blending real-time strategy and JRPG elements with branching paths and character permadeath.,
Okamoto Ayako to Match Play Golf - Ko Olina Golf Club in Hawaii,Golf sim with pro endorsement and Hawaiian course accuracy.,
Olivia no Mystery,Mystery adventure game featuring character Olivia solving puzzles in atmospheric locations.,
Olympic Summer Games,Sports compilation replicating summer Olympic events across multiple disciplines.,
On the Ball,Sports management sim focusing on soccer club roster and game strategy from boardroom to pitch.,
Ongaku Tsukuru Kanadeeru,"Music creation tool allowing players to compose, arrange, and record digital tunes.",
Onizuka Katsuya Super Virtual Boxing - Shin Kentou Ou Densetsu,"Boxing sim featuring real boxer Onizuka, focusing on punch timing and stamina strategy.",
Oonita Atsushi FMW,Wrestling game featuring real pro wrestler Atsushi Ōonita with deathmatch-themed stages.,
Oozumou Spirits,Sumo wrestling sim emulating traditional tournament arenas and weight classes.,
Operation Europe - Path to Victory 1939-45,Grand strategy sim of WWII’s European theater with real unit deployments and historical scenarios.,
Operation Logic Bomb: The Ultimate Search & Destroy,Cyberpunk action-platformer drenched in sci-fi combat and technology.,
Operation Thunderbolt,On-rails rail shooter faithfully adapting the arcade’s fast-paced shooting action.,
Oraga Land Shusai - Best Farmer Shuukakusai,Farming event sim combining agricultural mechanics with festival presentation.,
Oscar,Art-house adventure game with cinematic pacing and character-driven narrative.,
Ossu!! Karate-bu,"Dojo training sim focused on karate moves, tournament ranking, and practice-based progression.",
Othello World,Othello/Reversi simulation with challenge modes and varied AI opponents.,
The Ninja Warriors,Action side-scroller where cyborg ninjas fight oppressive regimes through dystopian cities.,
Otoboke Ninja Colosseum,"Battle arena with chaotic ninja fights, power-ups, and slapstick combat.",
Otogirisou: Hypericum Perforatum,Explore a mysterious mansion filled with puzzles and supernatural secrets.,
Out of This World | Another World,Survive a strange alien world after a lab accident in this cinematic action-adventure.,
Outlander,Navigate a post-apocalyptic wasteland in a thrilling vehicle combat journey.,
Pac-Attack,Defend your territory by stacking blocks and defeating ghosts in this Pac-Man puzzle game.,
Pac-in-Time,Help Pac-Man solve puzzles and fight enemies in a colorful platform adventure.,
Pac-Man 2: The New Adventures,Guide Pac-Man through cartoon-style levels solving problems and collecting fruit.,
Pachi-Slot Gambler,Experience realistic Japanese pachinko slot machines in this gambling simulation.,
Pachi-Slot Kanzen Kouryaku - Universal Shindai Nyuuka Volume 1,Master various pachinko slot strategies in this detailed simulator.,
Pachi-Slot Kenkyuu,Dive deep into pachinko slot mechanics and strategies for high scores.,
Pachi-Slot Land - Pachipachi Coin no Densetsu,Enjoy pachinko slot gameplay with multiple machines and challenges.,
Pachi-Slot Love Story,Experience a romantic-themed pachinko slot adventure with unique story elements.,
Pachi-Slot Monogatari: PAL Kougyou Special,Play special edition pachinko slot machines with unique features.,
Pachi-Slot Monogatari: Universal Special,Discover universal pachinko slot machines with varied gameplay.,
Pachinko Challenger,Test your luck and skills on classic pachinko machines.,
Pachinko Fan - Shouri Sengen,Become a pachinko master by winning big on challenging machines.,
Pachinko Maruhi Hisshouhou,Use secret techniques to dominate pachinko slot games.,
Pachinko Monogatari - Pachi-Slot mo Aru deyo!!,Enjoy a mix of pachinko and slot machine gameplay with story elements.,
Pachinko Monogatari 2 - Nagoya Shachihoko no Teiou,Continue the pachinko saga with new machines and challenges.,
Pachinko Ren-chan Tengoku - Super CR Special,Experience exciting pachinko action with special features and bonuses.,
Pachinko Tetsujin - Nanaban Shoubu,Battle through tough pachinko challenges with strategic play.,
Pachinko Wars,Engage in pachinko battles with multiple machines and opponents.,
Pachinko Wars II,Continue the pachinko tournament with advanced machines and competition.,
Pachio-kun Special,Play classic pachinko machines with fun and unique themes.,
Pachio-kun Special 2,Enjoy new pachinko challenges and exciting gameplay.,
Pachio-kun Special 3,Master the latest pachinko machines in this special edition.,
Pacific Theater of Operations,Command naval forces in intense World War II Pacific battles.,
Pacific Theater of Operations II,Lead your fleet through advanced Pacific War scenarios.,
Packy & Marlon,Join two friends on a platforming adventure to save their animal friends.,
Paladin's Quest,Embark on a fantasy RPG quest to defeat an ancient evil and restore peace.,
Panel de Pon,Solve colorful puzzles by matching blocks and triggering chain reactions.,
Panel de Pon - Event '98,Challenge new puzzles and compete in the Panel de Pon tournament.,
Panic in Nakayoshi World,Help cute characters escape hazards in this quirky action-puzzle game.,
Paperboy 2,Deliver newspapers through tricky neighborhoods while avoiding hazards.,
